"","de","en","es","fr","hu","it","ja","ko","nl","pl","pt","ru","zh-tw","zh","en-gb","tr","uk","cz","sk","th","ro","oc","ar","id","vi","fi"
"TMPE_GUIDE_HEAD_LaneArrowTool_Disabled due to highway rules","Aufgrund von Autobahn Regeln Deaktiviert","Changing lane arrows","Cambiar fechas de cruce","L'outils des flèches de route est désactivé en raison des règles de l'autoroute","Sáv előjelző nyilak módosítása","Modifica le frecce di corsia","車線の矢印を変更する","차선 화살표 변경","Wijzig rijstrookpijlen","Zmiana strzałek pasów ruchu","Mudando setas de faixa","Изменение стрелок для этого перекрёстка отключено","變更車道箭頭","更改车道行车导向箭头","Changing lane arrows","Etkin otoban kuralları nedeniyle şerit oku değiştiricisi bu şerit için devre dışı bırakıldı","Зміна стрілок на смугах руху заборонена","Změna jízdních pruhů","Zmena jazdných pruhov","ลูกศรเปลี่ยนเลน","","","ﺓﺭﺎﺤﻟﺍ ﻢﻬﺳﺍ ﺮﻴﻴﻐﺗ","Mengubah panah lajur","Việc thay đổi mũi tên chỉ hướng cho làn này bị vô hiệu hóa do bạn đã kích hoạt hệ quy tắc cho cao tốc",""
"TMPE_GUIDE_BODY_LaneArrowTool_Disabled due to highway rules","Die Richtungspfeile für diese Spur können nicht geändert werden, weil du die speziellen Regeln für Autobahnen aktiviert hast.","The lane arrow changer for this lane is disabled because you activated the highway rule system.","El editor de flechas está desactivado debido a que has activado el control de autopistas.","Le modificateur de directions pour cette voie est désactivé car vous avez activé le système de règles pour autoroutes.","Ennek a sávnak az előjelző nyilai nem módosíthatóak, mert aktiválta az autópálya szabályrendszert.","La modifica delle frecce direzionali per questa corsia è disabilitata perché è attivo il sistema di regole autostradali predefinito. Puoi disabilitarlo nelle opzioni alla voce ""Abilita regolazione specifica per le corsie autostradali"".","高速道路ルールシステムを適用しているため、この車線の矢印は変更できません","고속도로 규칙 시스템을 활성화했기 때문에 이 차선의 차선 화살표 변경은 비활성화되어 있습니다.","Het is niet mogelijk de voorrangspijlen op deze rijstroom te veranderen, omdat je de speciale regels voor snelwegen geactiveerd hebt.","Zmiana strzałek pasów została wyłączona dla tego pasa ponieważ aktywowałeś/łaś Zmienione zasady łączenia pasów dla Autostrad","O trocador de seta de pista está desabilitado porque você ativou o sistema de regras para rodovia.","Изменение стрелок для этого перекрёстка отключено, потому что включены особые правила для шоссейных дорог","「變更車行方向」功能已關閉，因為您已開啟「高速公路規則」","由于开启了高速公路特定规则, 因此导致该车道不能更改箭头.","The lane arrow changer for this lane is disabled because you activated the highway rule system.","Otoban kuralı dizgesini etkinleştirdiğiniz için şerit oku değiştiricisi bu şerit için devre dışı bırakıldı.","Зміна стрілок на смугах руху заборонена, оскільки на мапі включені особливі правила руху по смугах на шосе","Nelze změnit jízdní pruhy na dálnici se zapnutými pravidly silnice","Nie je možné zmeniť jazdné pruhy na diaľnici na ktorej sú zapnuté pravidlá","ลูกศรเปลี่ยนเลนสำหรับเลนนี้ ถูกปิดใช้งานเนื่องจากคุณเปิดใช้งานระบบกฎทางหลวง","","","ﻊﻳﺮﺴﻟﺍ ﻖﻳﺮﻄﻟﺍ ﺪﻋﺍﻮﻗ ﻡﺎﻈﻧ ﻂﻴﺸﻨﺘﺑ ﺖﻤﻗ ﻚﻧﻷ ﺮﻤﻤﻟﺍ ﺍﺬﻬﻟ ﺓﺭﺎﺤﻟﺍ ﻢﻬﺳ ﺮﻴﻐﻣ ﻞﻴﻄﻌﺗ ﻢﺗ","Pengubah panah lajur untuk lajur ini dimatikan karena Anda mengaktifkan sistem aturan tol.","Việc thay đổi mũi tên chỉ hướng cho làn này bị vô hiệu hóa do bạn đã kích hoạt hệ quy tắc cho cao tốc",""
"TMPE_GUIDE_HEAD_LaneArrowTool_Disabled due to lane connections","Aufgrund manueller Spuren zuweisung Deaktiviert","Changing lane arrows","Cambiar fechas de cruce","L'outils des flèches de route est désactivé en raison des connexions des voies","Sáv előjelző nyilak módosítása","Modifica le frecce di corsia","車線の矢印を変更する","차선 화살표 변경","Wijzig rijstrookpijlen","Zmiana strzałek pasów ruchu","Mudando setas de faixa","Изменение стрелок для этого перекрёстка отключено","變更車道箭頭","更改车道行车导向箭头","Changing lane arrows","Şerit bağlantılarını el ile yaptığınızdan dolayı bu şerit için şerit oku değiştiricisi devre dışı bırakıldı","Зміна стрілок на смугах руху заборонена","Změna jízdních pruhů","Zmena jazdných pruhov","ลูกศรเปลี่ยนเลน","","","ﺓﺭﺎﺤﻟﺍ ﻢﻬﺳﺍ ﺮﻴﻴﻐﺗ","Mengubah arah lajur","Thay đổi mũi tên chỉ hướng làn",""
"TMPE_GUIDE_BODY_LaneArrowTool_Disabled due to lane connections","Die Richtungspfeile für diese Spur können nicht geändert werden, weil du Spuren von Hand verbunden hast.","The lane arrow changer for this lane is disabled because you have created lane connections by hand.","El modificador de flechas de la carretera fue desactivado porque has creado las conexiones manualmente.","Le modificateur des directions de voies est désactivé pour cette voie car vous avez manuellement créé des connexions de voies.","Ennek a sávnak az előjelző nyilai nem módosíthatóak, mert kézzel hozott létre sávkapcsolatokat.","La modifica delle frecce direzionali per questa corsia è disabilitata perché hai creato la connessione della corsia manualmente.","手動で車線接続を作成したため、この車線の矢印の変更は無効になっています","수동으로 차선 연결을 생성했기 때문에 이 차선의 차선 화살표 변경은 비활성화되어 있습니다.","Voor deze rijstrook kan de rijstrookpijl niet aangepast worden, omdat je handmatig rijstrookverbindingen hebt gemaakt.","Zmiana strzałek pasów ruchu jest niedostępna, ponieważ pasy ruchu zostały połączone ręcznie.","O trocador de seta de faixa está desabilitado para essa faixa porque você criou uma conexão de faixa manualmente.","Изменение стрелок для этого перекрёстка отключено, потому что вы создали соединение полос движения вручную.","因為您已手動建立車道連接，無法在此車道上使用「變更車行方向」功能","由于此车道创建了车道连接, 因此导致该车道不能更改箭头.","The lane arrow changer for this lane is disabled because you have created lane connections by hand.","Şerit bağlantılarını el ile yaptığınızdan dolayı bu şerit için şerit oku değiştiricisi devre dışı bırakıldı.","Зміна стрілок на смугах руху заборонена, оскільки на цьому перехресті наявні вручну з'єднані смуги руху","Nelze změnit jízdní pruhy na silnici kde je ručně nastaven směr jízdy","Nie je možné zmeniť jazdné pruhy na ceste, ktorej je manuálne nastavený smer jazdy","ลูกศรเปลี่ยนเลนสำหรับเลนนี้ ถูกปิดใช้งานเนื่องจากคุณได้สร้างการเชื่อมต่อเลนด้วยตนเอง","","","ﺎﻳﻭﺪﻳ ﺓﺭﺎﺣ ﺕﻻﺎﺼﺗﺍ ﺀﺎﺸﻧﺈﺑ ﺖﻤﻗ ﻚﻧﻷ ﺮﻤﻤﻟﺍ ﺍﺬﻬﻟ ﺓﺭﺎﺤﻟﺍ ﻢﻬﺳ ﺮﻴﻐﻣ ﻞﻴﻄﻌﺗ ﻢﺗ","Pengubah panah lajur untuk lajur ini dimatikan karena Anda telah menyetel perhubungan lajur.","Việc thay đổi mũi tên chỉ hướng cho làn này bị vô hiệu hóa do bạn đã tạo kết nối làn thủ công.",""
"TMPE_GUIDE_HEAD_TimedTrafficLightsTool_Auto TL no need","Zeitgesteuerte Ampel","Timed traffic light","Semáforo cronometrado","Outil de feux de circulation chronométrés. Pas besoins car feu de circulation automatique","Időzített jelzőlámpa","Semaforo temporizzato","時限式信号機","신호등 시간표","Getimed verkeerslicht","Czasowa sygnalizacja świetlna","Semáforo cronometrado","Нет потребности в светофоре на этом перекрёстке","TL 腳本","定时红绿灯设置","TL Script","Hızlı kurulum desteklenmiyor","Немає потреби в такому світлофорі","Časované semafory","Časovo riadené semafory","ไฟจราจรแบบจับเวลา","","","ﺖﻗﻮﻟﺎﺑ ﺭﻭﺮﻣ ﺓﺭﺎﺷﺇ","Lampu lalu lintas berwaktu","Hẹn giờ đèn giao thông",""
"TMPE_GUIDE_BODY_TimedTrafficLightsTool_Auto TL no need","Die Schnellkonfiguration wird für diese Kreuzung nicht unterstützt","Quick-setup is not supported for this junction setup","Configuración rápida no es soportada para este cruce","Création automatique de feux inutile","Ez a csomópont-beállítás nem támogatja a gyorsbeállítást.","La configurazione rapida non è supportata","クイックセットアップはサポートされていません","이 교차로 설정에는 빠른 설정이 지원되지 않습니다","Auto VL niet nodig","wybrane skrzyżowanie go nie potrzebuje lub konfiguracja skrzyżowania nie jest obsługiwana","Não é necessária a criação de semáforos","нет потребности в светофоре на этом перекрёстке","不需自動化號誌","此路口设置不支持使用<快速设置>","Quick-setup is not supported","Hızlı kurulum desteklenmiyor","немає потреби в такому світлофорі на цьому перехресті","Rychlé nastavení nelze použít na danou křižovatku","Rýchle nastavenie sa nedá použiť na zvolenú križovatku","แยกนี้ไม่รองรับการติดตั้งแบบด่วน","","","ﺍﺬﻫ ﻊﻃﺎﻘﺘﻟﺍ ﺩﺍﺪﻋﻹ ﻡﻮﻋﺪﻣ ﺮﻴﻏ ﻊﻳﺮﺴﻟﺍ ﺩﺍﺪﻋﻹﺍ","Setelan cepat tidak didukung untuk persimpangan seperti ini","Thiết đặt nhanh không hỗ trợ cho giao lộ này",""
"TMPE_GUIDE_HEAD_LaneConnectorTool:stay-in-lane is not supported for this setup","Schnelle Einrichtung von Fahrspurverbindungen","Stay in lane","Permanecer en el carril","Outil de connecteur de voie : La configuration rapide n'est pas prise en charge pour cette configuration de carrefour/jonction","Maradjon a sávban","Configurazione rapida dei collegamenti di corsia","車線変更不可","이 교차로 설정에는 빠른 설정이 지원되지 않습니다","Snelle-setup van rijstrookverbindingen","Szybkie dopasowanie pasów ruchu","Configuração automática de conectores de faixas","Быстрая настройка полос не поддерживается","此設定不支援禁止變換車道","辅助连接禁止变更车道","Stay in lane","Şu anki ayarlarla şeritte kal özelliği desteklenmiyor","Швидке налаштування перехрестя не підтримується","Zůstat v pruhu","Zostať v pruhu","ห้ามเปลี่ยนเลน","","","ﺕﺍﺭﺎﻴﺴﻟﺍ ﻲﻄﺨﺗ ﻉﻮﻨﻤﻣ","Tetap di lajur","Giữ nguyên làn xe không hỗ trợ cho thiết lập này. Hãy chắc chắn rằng mỗi chiều có nhiều hơn 1 làn. Giữ nguyên làn sẽ kết nối các làn xe sao cho chúng không cắt nhau",""
"TMPE_GUIDE_BODY_LaneConnectorTool:stay-in-lane is not supported for this setup","Die Schnellkonfiguration wird für diese Kreuzung nicht unterstützt. Beachte, dass für eine T-Kreuzung die Arithmetik funktionieren sollte","Stay-in-lane is not supported for this setup. Make sure  are more than 1 lanes in each direction . Stay-in-lane connects lanes such that they do not crisscross. ","Permanecer en el carril no es soportado en esta configuración. Asegúrate que hay más de 1 carril en cada dirección. Permanecer en el carril conecta carriles de tal manera que no ocasione conflictos.","Outil de connecteur de voie : La configuration rapide n'est pas prise en charge pour cette configuration de carrefour/jonction","Ez a beállítás nem támogatja a sávban maradást. Ügyeljen arra, hogy minden irányban több mint 1 sáv legyen. A sávban maradás összeköti a sávokat, hogy ne keresztezzék egymást.","La configurazione rapida non è supportata per le impostazioni di questo incrocio. Si noti che per un incrocio a T l'aritmetica dovrebbe funzionare.","この設定では車線維持はサポートされていません。 各方向に1レーン以上あることを確認してください。 ステイインレーンは、交差しないようにレーンを接続します。","이 교차로 설정에는 빠른 설정이 지원되지 않습니다","Snelle-setup wordt niet ondersteund voor deze knooppunt-setup","Szybkie dopasowanie pasów ruchu nie jest dostępne dla tego układu skrzyżowania","Não há suporte para a configuração automática nessa junção. Observe que para uma intersecção em T, a ""aritmética de faixas"" deve funcionar.","Быстрая настройка полос не поддерживается для данной формы перекрёстка","此設定不支援禁止變換車道","此设置不支持使用<辅助连接禁止变更车道>. 确保每个方向都有1条以上的车道. 才能防止使用时车道连接线有相交出现.","Stay-in-lane connects lanes such that they don't criss-cross; it requires 2 or more lanes per direction.","Şu anki ayarlarla şeritte kal özelliği desteklenmiyor","Швидке налаштування перехрестя не підтримується для цієї комбінації доріг на даному перехресті","Zůstat v pruhu není pro toto nastavení dostupné. Ujistěte se že máte alespoň 1 jízdní pruh pro každý směr . Zůstaň v pruhu lze aplikovat pouze na silnici které se nekříží.","Zostať v pruhu nie je pre takéto nastavenie dostupné. Uistite sa, že máte aspoň jeden jazdný pruh pre každý smer. Zostať v pruhu je možné aplikovať len na cestách, ktoré sa nekrížia","ห้ามเปลี่ยนเลนไม่สามารถติดตั้งแยกนี้ได้ ตรวจสอบให้แน่ใจว่ามีมากกว่า 1 เลนในแต่ละทิศทาง การห้ามเปลี่ยนเลนคือเชื่อมเลนโดยไม่ตัดเลน","","","ﻊﻃﺎﻘﺘﺗ ﻻ ﺚﻴﺤﺑ ﺕﺍﺮﻤﻤﻟﺍ ﺭﺎﺴﻤﻟﺍ ﻲﻓ ﺀﺎﻘﺒﻟﺍ ﻡﺎﻈﻧ ﻂﺑﺮﻳ ﻩﺎﺠﺗﺍ ﻞﻛ ﻲﻓ ﺪﺣﺍﻭ ﺮﻤﻣ ﻦﻣ ﺮﺜﻛﺃ ﺩﻮﺟﻭ ﻦﻣ ﺪﻛﺄﺗ ﺩﺍﺪﻋﻹﺍ ﺍﺬﻬﻟ ﻡﻮﻋﺪﻣ ﺮﻴﻏ ﺭﺎﺴﻤﻟﺍ ﻲﻓ ﺀﺎﻘﺒﻟﺍ","Tetap-di-lajur tidak didukung untuk pengaturan seperti ini. Cek kembali bahwa terdapat lebih dari satu lajur untuk setiap arah. Tetap-di-lajur menghubungkan lajur agar mereka tidak menyilang.","Giữ nguyên làn xe không hỗ trợ cho thiết lập này. Hãy chắc chắn rằng mỗi chiều có nhiều hơn 1 làn. Giữ nguyên làn sẽ kết nối các làn xe sao cho chúng không cắt nhau",""
