"","de","en","es","fr","hu","it","ja","ko","nl","pl","pt","ru","zh-tw","zh","en-gb","tr","uk"
"TMPE_GUIDE_HEAD_LaneArrowTool_Disabled due to highway rules","","Changing lane arrows","","","Sávváltó nyilak letiltva az autópálya szabályok miatt","","","차선 화살표 변경","Wijzig rijstrookpijlen","Zmiana strzałek pasów ruchu","","","變更車道箭頭","更改车道行车导向箭头","Changing lane arrows","",""
"TMPE_GUIDE_BODY_LaneArrowTool_Disabled due to highway rules","Die Richtungspfeile für diese Spur können nicht geändert werden, weil du die speziellen Regeln für Autobahnen aktiviert hast.","The lane arrow changer for this lane is disabled because you activated the highway rule system.","El editor de flechas está desactivado debido a que has activado el control de autopistas.","Le modificateur de directions pour cette voie est désactivé car vous avez activé le système de règles pour autoroutes.","Ennek a sávnak a sáv nyílváltója le van tiltva, mert aktiválta az autópálya-szabályrendszert.","La modifica delle frecce direzionali per questa corsia è disabilitata perché è attivo il sistema di regole autostradali predefinito. Puoi disabilitarlo nelle opzioni alla voce ""Abilita regolazione specifica per le corsie autostradali"".","高速道路ルールシステムを適用しているため、この車線の矢印は変更できません","고속도로 규칙 시스템을 활성화했기 때문에 이 차선의 차선 화살표 변경은 비활성화되어 있습니다.","Het is niet mogelijk de voorrangspijlen op deze rijstroom te veranderen, omdat je de speciale regels voor snelwegen geactiveerd hebt.","Zmiana strzałek pasów została wyłączona dla tego pasa ponieważ aktywowałeś/łaś Zmienione zasady łączenia pasów dla Autostrad","O trocador de seta de pista está desabilitado porque você ativou o sistema de regras para rodovia.","Изменение стрелок для этого перекрёстка отключено, потому что включены особые правила для шоссейных дорог","「變更車行方向」功能已關閉，因為您已開啟「高速公路規則」","由于开启了高速公路特定规则, 因此导致该车道不能更改箭头.","The lane arrow changer for this lane is disabled because you activated the highway rule system.","Otoban kuralı dizgesini etkinleştirdiğiniz için şerit oku değiştiricisi bu şerit için devre dışı bırakıldı.","Зміна стрілок на смугах руху заборонена, оскільки на мапі включені особливі правила руху по смугах на шосе"
"TMPE_GUIDE_HEAD_LaneArrowTool_Disabled due to lane connections","","Changing lane arrows","","","Sávváltó nyilak letiltva a sáv összekötések miatt","","","차선 화살표 변경","Wijzig rijstrookpijlen","Zmiana strzałek pasów ruchu","","","變更車道箭頭","更改车道行车导向箭头","Changing lane arrows","",""
"TMPE_GUIDE_BODY_LaneArrowTool_Disabled due to lane connections","Die Richtungspfeile für diese Spur können nicht geändert werden, weil du Spuren von Hand verbunden hast.","The lane arrow changer for this lane is disabled because you have created lane connections by hand.","El modificador de flechas de la carretera fue desactivado porque has creado las conexiones manualmente.","Le modificateur des directions de voies est désactivé pour cette voie car vous avez manuellement créé des connexions de voies.","Ennek a sávnak a sáv nyílváltója le van tiltva, mert kézzel hozta létre a sávcsatlakozásokat.","La modifica delle frecce direzionali per questa corsia è disabilitata perché hai creato la connessione della corsia manualmente.","手動で車線接続を作成したため、この車線の矢印の変更は無効になっています","수동으로 차선 연결을 생성했기 때문에 이 차선의 차선 화살표 변경은 비활성화되어 있습니다.","Voor deze rijstrook kan de rijstrookpijl niet aangepast worden, omdat je handmatig rijstrookverbindingen hebt gemaakt.","Zmiana strzałek pasów ruchu jest niedostępna, ponieważ pasy ruchu zostały połączone ręcznie.","O trocador de seta de pista esta desabilitado para essa pista porque você criou uma conexão de pista manualmente.","Изменение стрелок для этого перекрёстка отключено, потому что вы создали соединение полос движения вручную.","因為您已手動建立車道連接，無法在此車道上使用「變更車行方向」功能","由于此车道创建了车道连接, 因此导致该车道不能更改箭头.","The lane arrow changer for this lane is disabled because you have created lane connections by hand.","Şerit bağlantılarını el ile yaptığınızdan dolayı bu şerit için şerit oku değiştiricisi devre dışı bırakıldı.","Зміна стрілок на смугах руху заборонена, оскільки на цьому перехресті наявні вручну з'єднані смуги руху"
"TMPE_GUIDE_HEAD_TimedTrafficLightsTool_Auto TL no need","","Timed traffic light","","","","","","신호등 시간표","Getimed verkeerslicht","Czasowa sygnalizacja świetlna","","","TL 腳本","定时红绿灯设置","TL Script","",""
"TMPE_GUIDE_BODY_TimedTrafficLightsTool_Auto TL no need","","Quick-setup is not supported for this junction setup","","Création automatique de feux inutile","","La configurazione rapida non è supportata","クイックセットアップはサポートされていません","이 교차로 설정에는 빠른 설정이 지원되지 않습니다","Auto TL niet nodig","wybrane skrzyżowanie go nie potrzebuje lub konfiguracja skrzyżowania nie jest obsługiwana","Não é necessária a criação de semáforos","нет потребности в светофоре на этом перекрёстке","不需自動化號誌","不支持使用<快速设置>","Quick-setup is not supported","Hızlı kurulum desteklenmiyor","немає потреби в такому світлофорі на цьому перехресті"
