"","de","en","es","fr","hu","it","ja","ko","nl","pl","pt","ru","zh-tw","zh","en-gb"
"Button:Delete mod","Löschen","Delete","Borrar","Suppr.","Töröl","Elimina","削除","삭제","Verwijderen","Skasuj","Apagar","Удалить","刪除","删除","Delete"
"Button:Unsubscribe mod","Abmelden","Unsubscribe","Desuscribir","Désabonner","Leiratkozás","Button:Unsubscribe mod","Button:Unsubscribe mod","Button:Unsubscribe mod","Button:Unsubscribe mod","Odsubskrybuj","Button:Unsubscribe mod","Отписаться","Button:Unsubscribe mod","取消订阅","Unsubscribe"
"Window.Title:Detected incompatible mods","detected incompatible mods","detected incompatible mods","detected incompatible mods","a détecté des mods incompatibles","nem kompatibilis modokat észlelt","detected incompatible mods","detected incompatible mods","와 비호환되는 모드 감지","detected incompatible mods","wykrył niekompatybilne mody","detected incompatible mods","обнаружил несовместимые моды","detected incompatible mods","检测到的不兼容MOD","detected incompatible mods"
"Checkbox:Scan for known incompatible mods on startup","Scan for known incompatible mods on startup","Scan for known incompatible mods on startup","Scan for known incompatible mods on startup","Rechercher les mods incompatibles au lancement","Keressen induláskor az ismert, nem kompatibilis modokat","Scan for known incompatible mods on startup","Scan for known incompatible mods on startup","게임 실행시 비호환되는 모드 스캔","Scan for known incompatible mods on startup","Uruchamiaj sprawdzanie przy starcie gry","Scan for known incompatible mods on startup","Сканирование известных несовместимых модов при запуске","Scan for known incompatible mods on startup","启动时检测是否存在已知不兼容MOD","Scan for known incompatible mods on startup"
"Checkbox:Ignore disabled mods","Checkbox:Ignore disabled mods","Ignore disabled mods","Checkbox:Ignore disabled mods","Ignorer les mods désactivés","Figyeljen a letiltott modokra","Checkbox:Ignore disabled mods","Checkbox:Ignore disabled mods","비활성화된 모드 무시하기","Checkbox:Ignore disabled mods","Ignoruj wyłączone mody","Checkbox:Ignore disabled mods","Игнорировать отключённые моды","Checkbox:Ignore disabled mods","忽略未启用MOD","Ignore disabled mods"
