"","de","en","es","fr","hu","it","ja","ko","nl","pl","pt","ru","zh-tw","zh","en-gb","tr","uk","cz","sk","th","ro","oc","ar","id","vi","fi"
"Keybind.RightClick:Leave node","Rechtsklick: Ausgewähltes Segment verlassen","Leave the selected node","Salir del nodo","Quitte l'outil noeud","Csomópont elhagyása","Lascia nodo","選択したノードを残す","노드 선택 해제","Verlaat het geselecteerde punt","Odznacz wybrany węzeł","Sair do nó selecionado","Покинуть выбранный перекрёсток или узел","退出所選的節點","取消选择该节点","Leave selected node","Kavşaktan ayrıl","Залишити обране перехрестя або вузол","Pravé kliknutí zruší výběr zvoleného uzlu","Pravé tlačítko zruší výber zvoleného uzlu","ออกจาก node","Nod ieșire","","ﺓﺩﺪﺤﻤﻟﺍ ﺓﺪﻘﻌﻟﺍ ﻙﺮﺗﺍ","Keluar dari persimpangan","Bỏ chọn nút",""
"Keybind.RightClick:Leave segment","Das ausgewählte Segment verlassen","Leave the selected segment","Salir del segmento","Quitter le segment","Szegmens elhagyása","Lascia segmento","選択したセグメントを残す","구간 선택 해제","Verlaat segment","Odznacz wybrany segment","Sair do segmento selecionado","Покинуть выбранный сегмент дороги","退出所選的路段","取消选择该路段","Leave selected segment","Bu parçadan ayrıl","Залишити обраний сегмент шляху","Pravé kliknutí zruší výběr zvoleného segmentu","Pravé tlačítko zruší výber zvoleného segmentu","ออกจาก segment","Segment de ieșire","","ﺩﺪﺤﻤﻟﺍ ﻊﻄﻘﻤﻟﺍ ﻙﺮﺗﺍ","Keluar dari ruas","Bỏ chọn đoạn đường",""
"Keybind.RightClick:Leave lane","Die ausgewählte Fahrspur verlassen","Leave selected lane","Salir del carril","Quitter la voie de circulation ou d'intersection","Sáv elhagyása","Lascia corsia","選択した車線をそのままにする","차선 선택 해제","Verlaat geselecteerde lijn","Odznacz wybrany pas","Sair da faixa selecionada","Покинуть режим редактирования полосы","退出車道","取消选择该车道","Leave selected lane","Şeritten ayrıl","Залишити обрану смугу руху","Opustit pruh","Opustiť pruh","ออกจาก lane","Bandă de ieșire","","ﺩﺪﺤﻤﻟﺍ ﺭﺎﺴﻤﻟﺍ ﻙﺮﺗﺍ","Keluar dari lajur","Bỏ chọn làn",""
"Roundabout.Option:Yielding vehicles keep clear of blocked roundabout","Kreisverkehr freihalten und Vorfahrt gewähren","Yielding vehicles keep clear of blocked roundabout","Vehículos cediendo paso no bloquean la rotonda","Au rond-point, restez à l'écart pour céder le passage","Elsőbbségadásra kötelezett járművek távol maradnak a telített körforgalomtól","I veicoli cedevoli si tengono lontani dalle rotonde bloccate","非優先道路の迂回路を避ける","회전교차로가 막히면 양보 차량 접근 금지","Voertuigen met voorrang blijven buiten geblokkeerde rotondes","Oczekujące pojazdy nie wjeżdżają na zablokowane rondo","Carros em espera devem esperar o bloqueio na rotatória","Уступающие не въезжают на заблокированную кольцевую развязку","禮讓圓環內的車輛以淨空堵塞的圓環","驶入环岛的车辆不能驶入堵塞的环岛排队","Yielding vehicles keep clear of blocked roundabout","Gelen araçlar tıkanık göbeğe girmez","Транспорт, який уступає дорогу, чекає перед перехрестям","Vozidla dávající přednost v jízdě se vyhnou plnému kruhovému objezdu","Vozidlá sa vyhýbajú zablokovaniu kruhového objazdu","ยานพาหนะที่ให้ทางให้หลีกเลี่ยงวงเวียนที่ถูกปิดกั้น","Vehiculele care cedează prioritatea nu intră în rond","","ﺩﻭﺪﺴﻤﻟﺍ ﺭﺍﻭﺪﻟﺍ ﻦﻋ ﺔﻠﻣﺎﺨﻟﺍ ﺕﺎﺒﻛﺮﻤﻟﺍ ﺪﻌﺘﺒﺗ","Kendaraan yg memberi jalan jangan masuk ke bundaran yang diblokir","Phương tiện nhường đường tránh xa các vòng xuyến bị chặn",""
"Roundabout.Tooltip:Yielding vehicles keep clear of blocked roundabout","Der Einfahrtsbereich in den Kreisverkehr wird freigehalten und die Fahrzeuge im Kreisverkehr haben Vorfahrt","If enabled, cars entering the roundabout will not enter blocked roundabout to avoid getting in the way of cars inside of the roundabout.
If disabled, traffic rule is untouched.","Vehículos cediendo paso no bloquean la rotonda","Au rond-point, restez à l'écart pour céder le passage","Ha engedélyezve van, akkor a körforgalomba tartó autók nem lépnek be a telített körforgalomba, hogy ne akadályozzák a körforgalomban lévő autókat.
Ha le van tiltva, a közlekedési szabály érintetlen.","I veicoli cedevoli si tengono lontani dalle rotonde bloccate","有効になっている場合、ラウンドアバウト交差点内の車の邪魔にならないように、ブロックされたときにラウンドアバウト交差点に入る車はラウンドアバウト交差点に入りません。
無効にすると、交通ルールは変更されません","켜면, 막힌 회전교차로에 진입하는 차량은 회전교차로 내부 차량을 방해하지 않도록 더 이상 진입하지 않습니다.
끄면, 기존의 교통 규칙을 유지합니다.","Voertuigen met voorrang blijven buiten geblokkeerde rotondes","Jeśli włączone pojazdy nie będą próbowały wjechać na zablokowane rondo co mogłoby tamować ruch na rondzie.\nJeśli wyłączone, aktualne ustawienie nie zostanie zmienione.","Caso habilitado, carros ao entrar a rotatória não irão furar o bloqueio de tráfego na rotatória.
Caso desabilitado, a regra de tráfego permanecerá intacta.","Уступающие не въезжают на заблокированную кольцевую развязку","禮讓圓環內的車輛以淨空堵塞的圓環","如果启用, 即将驶入环岛的车辆将不会驶入堵塞的环岛排队, 以免妨碍环岛内车辆行驶.\n如果禁用, 交通规则将不受影响.","If enabled, cars entering the roundabout will not enter blocked roundabout to avoid getting in the way of cars inside of the roundabout.
If disabled, traffic rule is untouched.","Gelen araçlar Tıkanık göbekten kaçınır","Транспорт, який уступає дорогу, чекає перед заблокованим перехрестям","Vozidla dávající přednost v jízdě se vyhnou plnému kruhovému objezdu","Vozidlá sa vyhýbajú zablokovaniu kruhového objazdu","ยานพาหนะที่ให้ทางให้หลีกเลี่ยงวงเวียนที่ถูกปิดกั้น","Vehiculele care cedează prioritatea nu intră pe drumuri blocate","","ﻝﺎﺠﻤﻟﺍ ﺢﺴﻔﺘﻟ ﺪﻌﺘﺑﺍ ، ﺭﺍﻭﺪﻟﺍ ﺪﻨﻋ","Jika aktif, kendaraan yang masuk ke bundaraan tidak akan masuk bundaran yang diblokir agar tidak berada di dalam jalannya kendaraan lainnya pada bundaran.
Jika mati, aturan lalu lintas tidak disentuh.","Nếu bật, xe tiến đến vòng xuyến sẽ không đi vào vòng xuyến bị chặn để tránh cản đường xe di chuyển bên trong vòng xuyến.
Nếu tắt, các quy tắc được giữ nguyên.",""
"Roundabout.Option:Assign realistic speed limits to roundabouts","Kreisverkehren realistische Geschwindigkeitsbegrenzungen zuweisen","Assign realistic speed limits to roundabouts","Asigna límites de velocidad realistas a las rotondas","Attribuer des limites de vitesse réalistes aux ronds-points","Reális sebességkorlátozások hozzárendelése a körforgalmakhoz","Assegna limiti di velocità realistici alle rotonde","ラウンドアバウト交差点に現実的な速度制限を割り当てる","회전교차로에 현실적인 속도 제한 부여","Geef rotondes een realistische snelheidlimiet","Ustaw relistyczne limity prędkości na rondzie","Atribuir limites de velocidade realistas para rotatórias","Задать реалистичное ограничение скорости для кругового движения","在圓環內套用較實際的速限","为环岛设置真实的速度上限","Assign realistic speed limits to roundabouts","Dönel kavşaklara gerçekçi hız limitleri ayarla","Реалістичні обмеження швидкості для кругових перехресть","Přiřadit realistické rychlosti pro kruhový objezd","Priradiť realistický rýchlostný limit pre kruhové objazdy","กําหนดขีด จํากัด ความเร็วที่สมจริงให้กับวงเวียน","Atribuie realistic limitele de viteză într-un rond","","ﺔﻳﺮﺋﺍﺪﻟﺍ ﺕﺎﻌﻃﺎﻘﺘﻠﻟ ﺔﻴﻌﻗﺍﻭ ﺔﻋﺮﺳ ﺩﻭﺪﺣ ﻦﻴﻋ","Terapkan batas kecepatan realistis pada bundaran","Gán giới hạn tốc độ thực tế cho vòng xuyến",""
"Roundabout.Tooltip:Assign realistic speed limits to roundabouts","Kreisverkehren realistische Geschwindigkeitsbegrenzungen zuweisen","reducing roundabout speed might reduce risk of accident in real word but does not boost traffic flow in this game.\n
This option is only for the purpose of adding realism to the game. ","Reducir velocidades en la rotonda reduce el riesgo de accidentes en la vida real pero no ayuda con el flujo de tráfico.\nEsta opción es solo para agregar realismo al juego.","Attribuer des limites de vitesse réalistes aux ronds-points","A körforgalom sebességének csökkentése csökkentheti a balesetveszélyt a való életben, de visszafogja a forgalmat ebben a játékban. \n
Ez az opció a nagyobb valósághűség lehetősége miatt került bele a játékba.","Assegna limiti di velocità realistici alle rotonde","ラウンドアバウト交差点の速度を下げると、実際の事故のリスクが減る可能性がありますが、このゲームの交通量は増えません。\n
このオプションは、ゲームにリアリズムを追加することのみを目的としています。","회전교차로 내 속도를 줄이면 실제 세계에서는 사고의 위험을 줄일 수 있지만 게임 내에서는 교통 흐름이 개선되는 효과를 가져다 주지 못합니다.\n
이 설정은 게임에 사실감을 더하기 위한 목적으로만 쓰입니다.","Geef rotondes een realistische snelheidlimiet","Obniżenie limitu prędkości w rzeczywistości może zredukować ryzyko wypadków, ale niestety nie poprawi ono płynności ruchu w grze.\n Opcja tylko w celu zwiększenia relizmu w grze.","Atribuir limites de velocidade realistas para rotatórias","Задать реалистичное ограничение скорости для кругового движения","在圓環內套用較實際的速限","为环岛设置真实的速度上限","Reducing roundabout speed might reduce risk of accident in real word\n
but does not boost traffic flow in this game.\n
This option is only for the purpose of adding realism to the game.","Dönel kavşaklara gerçekçi hız limitleri ayarla","Реалістичні обмеження швидкості для кругових перехресть","Nastaví realistické rychlosti pro kruhový objezd","Nastaví sa realistické rýchlostné obmedzenie pre kruhové objazdy","กําหนดขีด จํากัด ความเร็วที่สมจริงให้กับวงเวียน","Atribuie realistic limitele de viteză într-un rond","","ﻊﻗﺍﻮﻟﺍ ﻲﻓ ﺙﺩﺎﺣ ﻉﻮﻗﻭ ﺮﻃﺎﺨﻣ ﻞﻴﻠﻘﺗ ﻰﻟﺇ ﻥﺍﺭﻭﺪﻟﺍ ﺔﻋﺮﺳ ﻞﻴﻠﻘﺗ ﻱﺩﺆﻳ ﺪﻗ\n.ﺔﺒﻌﻠﻟﺍ ﻩﺬﻫ ﻲﻓ ﺭﻭﺮﻤﻟﺍ ﺔﻛﺮﺣ ﻖﻓﺪﺗ ﺯﺰﻌﻳ ﻻ ﻪﻨﻜﻟﻭ\n.ﺔﺒﻌﻠﻟﺍ ﻰﻟﺇ ﺔﻴﻌﻗﺍﻮﻟﺍ ﺔﻓﺎﺿﺇ ﺽﺮﻐﻟ ﻂﻘﻓ ﻮﻫ ﺭﺎﻴﺨﻟﺍ ﺍﺬﻫ","Mengurangi batas kecepatan bundaran mungkin dapat mengurangi risiko kecelakaan pada dunia nyata tapi tidak mendorong aliran lalu lintas pada game ini.
Opsi ini hanya sekadar menambah realisme kepada game.","Gán giới hạn tốc độ thực tế cho vòng xuyến",""
"Roundabout.Option:Put parking ban inside roundabouts","Parkverbot in Kreisverkehren festlegen","Put parking ban inside roundabouts","Prohibir estacionamientos dentro de las rotondas","Interdire le stationnement dans les ronds-points","A körforgalmakon belül parkolási tilalom elhelyezése","Vieta il parcheggio nelle rotonde","ラウンドアバウト内に駐車禁止を設置","회전교차로 내 주차 금지","Plaats parkeerverboden op rotondes","Ustaw zakaz parkowania na drogach wewnątrz ronda","Proibir o estacionamento na rotatória","Запретить парковку на круговом движение","圓環內禁止停車","禁止环岛内停车","Prevent cars from parking on the roundabout","Dönel kavşak içine park yasağı koy","Заборона паркування на кругових перехрестях","Zakáže parkování uvnitř kruhového objezdu","Zakáže parkovanie vo vnútri kruhového objazdu","ห้ามจอดรถในวงเวียน","Interzice parcatul într-un rond","","ﺭﺍﻭﺪﻟﺍ ﻞﺧﺍﺩ ﻑﻮﻗﻭ ﺮﻈﺣ ﻊﺿﻭ","Terapkan larangan parkir di dalam bundaran","Cấm đỗ xe bên trong vòng xuyến",""
"Roundabout.Option:Put parking ban on roundabout branches","Parkverbot an Zufahrtsstraße zu Kreisverkehren festlegen","Put parking bans on roundabout branches","Prohibir estacionamientos en las entradas y salidas de las rotondas","Interdire le stationnement sur les routes entrantes/sortantes du rond-point","A körforgalom bekötőútjain parkolási tilalom elhelyezése","Vieta il parcheggio sui bordi delle rotonde","ラウンドアバウト交差点の進入路に駐車禁止を設ける","회전교차로로 접근하는 도로에서 주차 금지","Verbied parkeren op wegen die de rotonde binnenkomen/verlaten","Ustaw zakaz parkowania na drogach dojazdowych/zjazdowych ronda","Proibir o estacionamento nas ruas de entrada e saída da rotatória","Запретить парковку вокруг и на кольцевой развязке","出入圓環的道路上禁止停車","禁止环岛内停车","Prevent cars from parking on roundabout branches","Dönel kavşak dallarına park yasağı koy","Встановити заборону паркування на кругових перехрестях","Zakáže parkování na okrajích kruhového objezdu","Zakáže parkovanie na okraji kruhového objazdu","วางมาตรการห้ามจอดรถในวงเวียน","Interzice parcatul pe benzile dintr-un rond","","ﺔﻳﺮﺋﺍﺪﻟﺍ ﻉﻭﺮﻔﻟﺍ ﻰﻠﻋ ﺮﻈﺣ ﻊﺿﻭ","Terapkan larangan parkir pada cabang-cabang bundaran","Cấm đỗ xe tại các ngã rẽ vòng xuyến",""
"VR.Option:No double crossings","Keine doppelten Übergänge","Remove widest crossing on transitions between two types of road","En una transición de segmento a segmento, solo los segmentos más pequeños muestran cruce peatonal","Dans une transition d'un segment à un autre, seul le plus petit segment aura un passage piéton","A szegmensek közötti átmenetnél csak a kisebb szegmens kap gyalogátkelőt.","Nessun doppio attraversamento","セグメント間の横断歩道が二重になるのを防止し、狭い道路側のみにする","구간이 바뀔 때 더 작은 구간에서만 교차로가 생성됩니다.","Geen dubbele kruisingen","Przejście dla pieszych tylko na węższym segmencie przy łączeniu segmentów różnej szerokości","Sem cruzamentos duplos","Без двойных пешеходных переходов","禁用雙重行人穿越道","禁用双方向人行横道","Remove widest crossing on transitions between two types of road","Çift kesişim olamaz","Заборонити подвійні пішохідні переходи","Žádné dvojité přecházení","Dvojité priechody pre chodcov nie sú možné","ไม่มีการข้ามสองครั้ง","Fără încrucișări duble","","ﺕﺎﻌﻃﺎﻘﺗ ﻰﻠﻋ ﻂﻘﻓ ﺮﻐﺻﻷﺍ ﺀﺰﺠﻟﺍ ﻞﺼﺤﻳ ، ﺀﺰﺟ ﻰﻟﺇ ﺀﺰﺟ ﻦﻣ ﻝﺎﻘﺘﻧﻻﺍ ﻲﻓ","Pada transisi ruas-ke-ruas, hanya ruas yang lebih kecil yang mendapatkan penyeberangan.","Không có nút giao giữa hai loại đường",""
"VR.Option:Dedicated turning lanes","Dedizierte Abbiegespuren","Dedicated turning lanes","Carriles dedicados para girar","Voies dédiées pour tourner","Dedikált kanyarodósávok","Corsie di svolta dedicate","専用の右左折レーン","회전 전용 차선","Toegewijde lijn om terug te draaien","Dedykowane pasy do skrętu","Faixas de curva dedicadas","Выделенные полосы для поворота","專用轉向車道","专用转弯车道","Dedicated turning lanes","Dönüş şeritleri ayrılır","Виділені смуги для руху в різних напрямках","Vyhrazené odbočovací pruhy","Vyhradené odbočovacie pruhy","เลนเลี้ยวเฉพาะ","Benzi speciale de întoarcere","","ةصصخملا ةراودلا تارمملا","Lajur belok khusus","Làn rẽ riêng",""
"General.Checkbox:Use UnifiedUI","UnifiedUI verwenden","Use UnifiedUI","Utilizar UnifiedUI","Utiliser 'UnifiedUI'","","Usa UnifiedUI","UnifiedUIを使用","UnifiedUI 사용","Gebruik UnifiedUI","Użyj UnifiedUI","Utilizar Ui unificada","Использовать UnifiedUI","將主選單圖示加入 UnifiedUI 選單","使用 UnifiedUI","Use UnifiedUI","UnifiedUI kullan","Розмістити кнопку TM:PE в панелі UnifiedUI","Použít UnifiedUI","Použi UnifiedUI","ใช้ UnifiedUI","Folosește UnifiedUI","","استخدام واجهة مستخدم موحدة","Gunakan UnifiedUI","Độ mờ giao diện",""
"Keybind.SpeedLimits:Decrease selected speed","Ausgewählte Geschwindigkeit verringern","Decrease selected speed","Reducir la velocidad seleccionada","Diminuer la vitesse sélectionnée","","Riduci la velocità selezionata","選択した速度を下げる","선택한 속도 제한 감소","Verlaag geselecteerde snelheid","Zmniejsz wybraną prędkość","Diminuir velocidade selecionada","Уменьшить выбранную скорость","收緊速限","降低目标车速","Decrease selected speed","Seçilen hız sınırını azaltmak için klavye kısayolu","Зменшити обрану швидкість","Sníží zvolenou rychlost","Znížiť zvolenú rýchlosť","ลดขีดจำกัดความเร็ว","Micșorează viteză selectată","","ﺓﺩﺪﺤﻤﻟﺍ ﺔﻋﺮﺴﻟﺍ ﺾﻔﺧ ","Kurangkan kecepatan","Giảm tốc độ đã chọn",""
"Keybind.SpeedLimits:Increase selected speed","Ausgewählte Geschwindigkeit erhöhen","Increase selected speed","Aumentar la velocidad seleccionada","Augmenter la vitesse sélectionnée","","Aumenta la velocità selezionata","選択した速度を上げる","선택한 속도 제한 증가","Verhoog geselecteerde snelheid","Zwiększ wybraną prędkość","Aumentar velocidade selecionada","Увеличить выбранную скорость","提高速限","提高目标车速","Increase selected speed","Seçilen hız sınırını artırmak için klavye kısayolu","Збільшити обрану швидкість","Zvýší zvolenou rychlost","Zvýšiť zvolenú rýchlosť","เพิ่มขีดจำกัดความเร็ว","Mărește viteza selectată","","ﺓﺩﺪﺤﻤﻟﺍ ﺔﻋﺮﺴﻟﺍ ﺓﺩﺎﻳﺯ","Tingkatkan kecepatan","Tăng tốc độ đã chọn",""
"KeybindCategory:SpeedLimits","Geschwindigkeitsbegrenzungen","Speed Limits","Límites de velocidad","Limites de Vitesse","","Limiti di velocità","制限速度","속도 제한","Snelheidslimieten","Limity prędkości","Limites de velocidade","Ограничения скорости","速限","限速","Speed Limits","Hız limitleri","Обмеження швидкості","Rychlostní limity","Rýchlostné obmedzenia","จำกัดความเร็ว","Limita de Viteza","","هذا عنوان مجموعة / قسم في خيارات التعديل علامة التبويب Keybinds التي تحتوي على العديد من اختصارات لوحة المفاتيح المتعلقة بأداة حدود السرعة","Batas Kecepatan","Giới hạn tốc độ",""
"General.Group:Localisation","Lokalisierung","Localization","Localización","Localisation","","General.Group:Localizzazione","言語設定","언어 설정","Lokalisatie","Lokalizacja","Localização","Локализация","語言翻譯","本地化","Localisation","Dil Ayarları","Локалізація","Lokalizace","Lokalizácia","ภาษาที่รองรับ","Localizare","","ﻊﻗﻮﻤﻟﺍ","Bahasa dan Lokalisasi","Vùng bản địa",""
"General.Group:Interface","Interface","Interface","Interfaz","Interface","","General.Group:Interfaccia","インターフェース","인터페이스","Bediening","Interfejs","Interface","Интерфейс","介面","接口","Interface","Arayüz","Інтерфейс","Rozhraní","Rozhranie","อินเตอร์เฟซ","Interfață","","ﻡﺪﺨﺘﺴﻤﻟﺍ ﻪﻬﺟﺍﻭ","Tampilan","Giao diện",""
"General.Group:Compatibility","Kompatibilität","Compatibility","Compatibilidad","Compatibilités","","General.Group:Compatibilità","互換性","호환성","Compatibiliteit","Zgodność","Compatibilidade","Совместимость","相容性","兼容性","Compatibility","Uyumluluk","Сумісність","Kompatibilita","Kompatibilita","ความเข้ากันได้","Compatibilitate","","ﻖﻓﺍﻮﺘﻟﺍ","Kompatibilitas","Khả năng tương thích",""
"General.Button:Help us translate on Crowdin","Hilf uns bei der Übersetzung auf Crowdin","Help us translate on Crowdin","Ayúdanos a traducir en Crowdin","Aidez-nous à traduire sur Crowdin","","Aiutaci a tradurre su Crowdin","Crowdinで翻訳を手伝ってください","Crowdin에서 번역을 도와주세요","Help ons vertalen op Crowdin","Pomóż w tłumaczeniu na Crowdin","Ajude-nos a traduzir no Crowdin","Помогите нам с переводом на Crowdin","提供翻譯協助","在 Crowdin 上帮助我们翻译","Help us translate on Crowdin","Crowdin'de tercüme etmemize yardım et","Допоможіть нам з перекладом на Crowdin","Pomozte nám s překladem na Crowdin","Pomôžte s prekladom na Crowdin","ช่วยเราแปลใน Crowdin","Ajută-ne să traducem pe Crowdin","","يظهر الزر في علامة تبويب الإعدادات العامة ضمن القائمة المنسدلة للغة. يؤدي النقر فوقه إلى تشغيل Crowdin Url","Bantu kami menerjemah di Crowdin","Giúp chúng tôi dịch trên Crowdin",""
"General.Button:View localisation guide","Übersetzungsleitfaden anzeigen","View localization guide","Ver guía de localización","Voir le guide des Localités","","Visualizza la guida alla localizzazione","ローカライズのガイドを表示","현지화 도움말 보기","Bekijk de lokalisatie handleiding","Zobacz przewodnik lokalizacji","Visualizar guia de localização","Руководство по локализации","關於多國語言翻譯","查看本地化指南","View localisation guide","Yerelleştirme kılavuzunu görüntüle","Інструкції з локалізації","Zobrazit návod pro překlad do jiného jazyka","Zobraziť sprievodcu s lokalizáciou","ดูคู่มือการแปลเป็นภาษาท้องถิ่น","Vezi ghidul de localizare","","يظهر الزر في علامة التبويب ""عام"" أسفل الزر Crowdin. يؤدي النقر فوقه إلى فتح صفحة الترجمة على موقع wiki الخاص بنا","Lihat petunjuk lokalisasi","Xem hướng dẫn bản địa hóa",""
"What's New?","Was gibt es Neues?","What's New?","¿Qué hay de nuevo?","Quoi de neuf ?","","Che c'è di Nuovo?","新着情報","새로운 기능","Wat is er nieuw?","Co nowego?","O que há de novo?","Что нового?","查看更新内容","查看更新内容","What's New?","Ne var ne yok?","Що нового?","Co je nového?","Čo je nové?","มีอะไรใหม่?","Ce este nou?","","ما الجديد؟","Apa yang baru?","Có gì mới?",""
"General.Slider:Window opacity","Fensterdeckkraft","Window opacity","Transparencia de ventana","Opacité de la fenêtre","","Opacità della finestra","ウィンドウの透明度","창 투명도","Ondoorzichtigheid van venster","Przeźroczystość okna","Opacidade da Janela","Прозрачность окна","視窗不透明度","界面不透明度","Window opacity","Pencere opaklığı","Непрозорість вікна","Průhlednost okna","Priehľadnosť okna","ความโปร่งใสของหน้าต่าง","Transparență Ferestrei","","","Opasitas Jendela","Độ mờ cửa sổ",""
