"","de","en","es","fr","hu","it","ja","ko","nl","pl","pt","ru","zh-tw","zh","en-gb","tr","uk","cz","sk","th"
"Dialog.Title:Vehicle restrictions","Fahrzeugbeschränkungen","Vehicle restrictions","Restricción vehicular","Restrictions des véhicules","Jármű-korlátozások","Restrizioni veicoli","車両規制","차량 제한","Voertuigbeperkingen","Ograniczenia ruchu pojazdów","Restrições de veículos","Ограничения видов транспорта","車種限定","道路车种限制","Vehicle restrictions","Taşıt kısıtlamaları","Обмеження видів транспорту","Omezení vozidel","",""
"Button:Invert","Invertieren","Invert","Invertir","Inverser","Invert","Inverti","反転","반전","Inverteren","Odwróć","Inverter","Инвертировать","對調選擇","反转","Invert","Evirt","Перемкнути всі навпаки","Invertovat","",""
"Button:Allow all vehicles","Erlaube alle Fahrzeuge","Allow all vehicles","Permitir a todos los vehículos","Autoriser tous les véhicules","Minden jármű engedélyezése","Permetti l'accesso a tutti i veicoli","全車両を許可","모든 차량 허가","Sta alle voertuigen toe","Zezwól dla wszystkich pojazdów","Permitir todos os veículos","Разрешить всему транспорту","通行所有車種","允许所有车种通行","Allow all vehicles","Tüm taşıtlara izin ver","Дозволити всім","Povolit všechny vozidla","",""
"Button:Ban all vehicles","Verbiete alle Fahrzeuge","Ban all vehicles","Prohibir a todos los vehículos","Interdire tous les véhicules","Minden járművet tiltsa le","Bandisci tutti i veicoli","全車両を禁止","모든 차량 금지","Verbied alle voertuigen","Zablokuj dla wszystkich pojazdów","Proibir todos os veículos","Запретить всему транспорту","禁行所有車種","禁止所有车种通行","Ban all vehicles","Tüm taşıtları yasakla","Заборонити всім","Zakázat všechny vozidla","",""
"Button:Apply to entire road","Wende Fahrzeugbeschränkungen auf alle Straßensegmente zwischen zwei Kreuzungen an","Apply vehicle restrictions to entire road","Aplicar restricción vehicular a todas los segmentos de calle entre dos cruces","Appliquer les restrictions de véhicules à tous les segments de route entre deux intersections","A járművek korlátozásait kell alkalmazni az összes útszakaszra két kereszteződés között","Applica le restrizioni a tutta la strada","交差点間の全道路に車両規制を適用","두 교차로 구간에 동일한 차량 제한 적용","Pas voertuigbeperkingen toe op alle wegsegmenten tussen twee kruisingen","Zastosuj ograniczenia ruchu pojazdów do wszystkich segmentów drogi pomiędzy dwoma skrzyżowaniami","Aplicar restrições de veículos para todos os segmentos de estrada entre dois cruzamentos","Применить на участок дороги между перекрёстками","對兩個路口間的全部路段套用車種限定","应用车种限制设置至两个路口之间所有路段","Apply vehicle restrictions to entire road","Taşıt kısıtlamalarını tüm yola uygula","Застосувати до всієї дороги між перехрестями","Nastavit omezení pro celou silnici","",""
"VR.OnscreenHint.Mode:Select segment","Segment auswählen","Choose a segment to edit","","RV. Conseil à l'écran. Mode : Sélectionnez un segment
S'affiche lorsque l'outil Restrictions du Véhicule est actif, demandant à l'utilisateur de sélectionner un segment à modifier
Fichier : TM: PE - Outils - Restrictions concernant les Véhicules","","","","","Selecteer een segment om te bewerken","Wybierz segment drogi, aby edytować","","Выберите сегмент дороги для редактирования","","","Choose a segment to edit","","Оберіть сегмент шляху","Zobrazuje se, když je aktivní nástroj Omezení vozidla s žádostí o výběr segmentu, který chcete upravit","",""
"VR.OnscreenHint.Mode:Toggle restrictions","Fahrzeugbeschränkungen ändern","Click vehicle icons to toggle restrictions","","RV. Conseil à l'écran. Mode : Basculer les restrictions
S'affiche lorsque l'outil Restrictions de véhicule a un segment sélectionné, suggérant que l'utilisateur peut maintenant cliquer sur certains signes de type de véhicule.
Fichier : TM: PE - Outils - Restrictions concernant les véhicules","","","","","Schakel beperkingen aan of uit","Kliknij na ikonę pojazdu, aby wł/wył ograniczenie","","Нажимайте на значки ограничений для переключения","","","Click vehicle icons to toggle restrictions","","Натискайте на знаки для заборони видів транспорту","Zobrazí se, když má nástroj Omezení vozidla vybrán segment, což naznačuje, že uživatel nyní může kliknout na některé značky typu vozidla","",""
"VR.Label:Revert to default","","Revert to default","","RV. Label : Rétablir la valeur par défaut
Affiché à l'écran : Supprimer | Retour arrière par défaut
Fichier : TM: PE - Outils - Restrictions concernant les véhicules","","","","","Zet terug naar standaard","Przywróć to ustawień domyślnych","","Сбросить по умолчанию","","","Revert to default","","Скинути як було до змін","Zobrazeno v nápovědě na obrazovce: Odstranit | Návrat k výchozímu nastavení","",""
